title,description,time_posted,url,subreddit,scraped_at
[Hiring] Web dev - Make me a website,"Looking for someone to build a clean, high-converting website for my commercial cleaning business. Budget is $500 CAD. The site must be modern, professional, and structured to convert traffic into leads. It needs to be SEO-optimized, LSA-ready, and mobile-friendly. I’ll provide the content I just need someone who can build it fast, work with me on quick revisions, and make it look sharp without unnecessary fluff. Build trust, explain what we do clearly, and generate quote requests from property managers, business owners, and commercial clients. If you’re efficient, responsive, and know how to build a website that is clean, this is for you. DM me with samples and let’s get started right away.",11 days ago,https://www.reddit.com/r/forhire/comments/1m988uq/hiring_web_dev_make_me_a_website/,r/forhire,2025-08-05T15:28:50.820981
"[Hiring] College Admissions Essay Editor – Part-Time, Remote ($2,000/month)","Contract Dates: August 15 – January 15 Pay: $2,000/month (flat rate) Location: 100% Remote | Flexible Schedule About Us We’re a U.S.-based college admissions consulting company that partners with top education institutions in China. We support high-achieving students applying to competitive U.S. colleges, with occasional work on grad school, MBA, or summer program applications.",20 hr. ago,https://www.reddit.com/r/forhire/comments/1mhhicf/hiring_college_admissions_essay_editor_parttime/,r/forhire,2025-08-05T15:28:50.939935
[Hiring] YT Thumbnail Designer - Long Term Only ($ per thumbnail),"PLEASE ONLY APPLY IF YOU HAVE SERIOUS VIDEO EDITING EXPERIENCE (i don't want to waste your time). I'm looking for a long-term YouTube Thumbnail Designer to partner with. This includes editing 2-3 Thumbnails per week. These are NOT hype-driven videos (no gaming, no music videos, no funny videos). These are educational videos for the SMMA, AI Automation, Wholesaling & Agency niche. 📌 About the Channel Channel: Phleet SMS Country: USA Current Size: 1.16k Subs | 305k+ Views Posting Type: Paid Per Video (Flat Rate — Negotiable)",12 hr. ago,https://www.reddit.com/r/forhire/comments/1mhu7g2/hiring_yt_thumbnail_designer_long_term_only_per/,r/forhire,2025-08-05T15:28:51.053401
[HIRING] Digital Marketing Specialist (Crypto) - $25/hr,"Hey guys, We are CLS Global, marketing agency focused on helping our clients grow within the crypto sphere. We take on projects and drive high-quality traffic to clients' projects through multiple channels such as Discord, Reddit, Twitter/X, etc. We're currently looking for an experienced Marketing Specialist to join our growing team! Requirements: Strong background and experience in the crypto space (for example, daily use, following projects)",9 days ago,https://www.reddit.com/r/forhire/comments/1mapt4r/hiring_digital_marketing_specialist_crypto_25hr/,r/forhire,2025-08-05T15:28:51.169654
"[FOR HIRE] Front-End Web Developer – Fast, Responsive, & Modern UI ($25/hr, 10 hrs/week)","Hello! 👋 I'm Saadiya Ambereen, a front-end web developer with 4+ years of experience crafting clean, fast, and responsive websites for small businesses, startups, and agencies. ✔️ Portfolio: https://saadiya.dev ✔️ Specializing in: Front-end development, UI/UX improvements, performance optimization ✔️ Tech Stack: React, Next.js, Tailwind, JavaScript, WordPress (Gutenberg & Oxygen Builder), Bootstrap 💡 What I Offer: ✅ Front-End Development – Pixel-perfect, responsive, and interactive websites ✅ – Animations, smooth scrolling, and intuitive user experiences ✅ – Faster load times, SEO improvements, and accessibility fixes ✅ – Framer, Webflow, WordPress, Wix, and Shopify",33 min. ago,https://www.reddit.com/r/forhire/comments/1mi74ko/for_hire_frontend_web_developer_fast_responsive/,r/forhire,2025-08-05T15:28:51.270932
[Hiring] Webflow Designer/Web Developer (Up to $40 USD / hr),"Hi there, We're looking to fill a seat for a website designer using the webflow platform for our digital agency! For your first job we are looking to design a website for a community in Australia to advertise events, tourism and things to do in their area. I have a scaffold, design brief and a colour palette ready. Please share with me: - Your rates (hourly or per project, in USD) - Your location/time zone - Portfolio or links to your best work. Please ensure that atleast 1 or 2 of your examples have the time taken to complete and the amount you would charge for that project.",6 days ago,https://www.reddit.com/r/forhire/comments/1mcvvbb/hiring_webflow_designerweb_developer_up_to_40_usd/,r/forhire,2025-08-05T15:28:51.362311
[task] [hiring] Need help normalizing audios on 1 hour long podcast,"My friend and I recorded an hour long podcast, and I messed up the audio mixing in OBS, so one speaker is way louder than the other. If someone has a magic button on some editing software that perfectly normalizes the audio, that would be great, else one may have to go through and manually adjust the audio throughout the video. The audios are only on one track. Still, it is fairly straightforward. Would be willing to pay $20-$25 for this task, and would want it ready by Tuesday night EST or Wednesday morning EST at the latest. I have Venmo, Paypal and Zelle as available payment methods. DM me if you are interested and I can send the file link. Thanks!",10 hr. ago,https://www.reddit.com/r/forhire/comments/1mhx9d8/task_hiring_need_help_normalizing_audios_on_1/,r/forhire,2025-08-05T15:28:51.449260
[FOR HIRE] Best Mobile & Web Apps DEVELOPER & DESIGNER👨🏻‍💻🎨 w/ MILLIONS OF DOWNLOADS,"Hi, I'm Nick. I'm a European Developer with 7+ years of work experience (14 years of studying). I am an EXPERT in Mobile Development and Product Design, having worked on many projects, ranging from Startups to Big Companies over the last 7 years. This helped me gain a lot of experience with launching Mobile Apps and understanding what works and what doesn't for your MVP. I just completed 1 Big project and now my schedule is opening up, I mainly build Mobile Apps and Web apps. In one of these last projects, we reached 140k unique daily users 😱 and topped the daily apps chart with millions of downloads. #NEW PORTFOLIO Link #WHAT YOU WILL GET IF I BUILD YOUR PRODUCT#",22 days ago,https://www.reddit.com/r/forhire/comments/1lzsbrq/for_hire_best_mobile_web_apps_developer_designer/,r/forhire,2025-08-05T15:28:51.575613
[Hiring] Bookkeeper/Accountant For Watch Company Pay is $800-$1200 Per Week,"Hello all, Our company, Ademato Jewelry, is a fast-growing luxury watch wholesaler seeking an experienced bookkeeper/accountant to manage monthly financials, reconcile accounts, and assist with tax prep. Must be familiar with QuickBooks, Microsoft, Excel, Google Sheets, etc This is a full-time position. Tasks include bank/credit card reconciliations, financial reports, and organizing expenses Bonus if you’ve worked with product-based or inventory-heavy businesses",16 hr. ago,https://www.reddit.com/r/forhire/comments/1mhpe20/hiring_bookkeeperaccountant_for_watch_company_pay/,r/forhire,2025-08-05T15:28:51.689011
[Hiring] Need editor for documentary style YT videos,"Hey, I’m currently looking for an editor who can replicate a style similar to this editing style: https://www.youtube.com/watch?v=-8lUFb115So budget is $20-$30 dollars per min negotiable send your portfolio and rates asap Only experienced professional editors reach out asap Budget $20 - $50/min negotiable",52 min. ago,https://www.reddit.com/r/forhire/comments/1mi6r9q/hiring_need_editor_for_documentary_style_yt_videos/,r/forhire,2025-08-05T15:28:51.774556
"GitHub CEO Thomas Dohmke Warns Developers: ""Either Embrace AI or Get Out of This Career""",,38 min. ago,https://www.reddit.com/r/programming/comments/1mi7149/github_ceo_thomas_dohmke_warns_developers_either/,r/programming,2025-08-05T15:29:02.103552
"Sam Altman says world wants 1000x more Software, So Programmer Salaries are Skyrocketing",,12 days ago,https://www.reddit.com/r/programming/comments/1m83u4g/sam_altman_says_world_wants_1000x_more_software/,r/programming,2025-08-05T15:29:02.357495
Stop forcing AI tools on your engineers,,28 days ago,https://www.reddit.com/r/programming/comments/1luk6dz/stop_forcing_ai_tools_on_your_engineers/,r/programming,2025-08-05T15:29:02.512293
"Got into a funk after college, what should I focus on to become a good software developer?","Close friend of mine passed, took a non-programing job. I feel like I forgot everything I learned. But I don't want to give up. I want to work towards my dream job again now that I am in a better place. Any advice?",31 min. ago,https://www.reddit.com/r/cscareerquestions/comments/1mi76p6/got_into_a_funk_after_college_what_should_i_focus/,r/cscareerquestions,2025-08-05T15:29:16.809903
"Junior / Mid-level engineers feeling invisible or stuck, hope this helps!","For all the engineers that are feeling invisible, stuck or plateaued, this is for you and hope it helps / guides you into the next steps. I am a senior software engineer who got to this position pretty fast, and got promoted over other engineers with 3-4x my YoE, so whatever I saw in this post contributed massively to my growth, making my impact visible, getting me recognized, and eventually promoted. As a junior engineer, I was always awed by these senior+ engineers who seemed to make such an impact by whatever they did. This led me to start observing and building relationships with some of these really senior engineers around me (staff/principal) and learn how they operated, built that authority around them, and got stuff done, and something clicked.",17 hr. ago,https://www.reddit.com/r/cscareerquestions/comments/1mhmy7l/junior_midlevel_engineers_feeling_invisible_or/,r/cscareerquestions,2025-08-05T15:29:17.121334
AI Coding Tools Slow Down Developers,,24 days ago,https://www.reddit.com/r/webdev/comments/1ly53mb/ai_coding_tools_slow_down_developers/,r/webdev,2025-08-05T15:29:27.823536
Software for online teacher and student to keep track of lessons owed?,"I work as an online freelance teacher. In most cases, students buy a package of lessons and then we book the lessons, either at the end of a lesson or using calendly. I currently keep track of the number of lessons I owe them by adding a counter in the events in google calendar. In the cases where they owe me, the counter is negative. But the students don't have access to this counter. And sometimes there may be subtle misunderstandings about the counter. For instance, a student cancels in the last moment and they aren't aware that I have a 72h cancelling policy (because they haven't read my terms of service) so they think the lesson isn't spent. Or somtimes it's a parent paying, teenagers forget lessons... I can send emails informing of the state of the counter but would look a bit weird.",1 mo. ago,https://www.reddit.com/r/freelance/comments/1lt9fvq/software_for_online_teacher_and_student_to_keep/,r/freelance,2025-08-05T15:29:48.838656
"[Hiring] Full Stack Developer (TypeScript, React, Next.js, Tailwind) based in India / LATAM","Hi! I'm looking for a talented Frontend Developer with 3-5 years of experience in TypeScript, React, Next.js, and Tailwind CSS for a full-time role. Ideal Candidate ✅ 3-5 years of hands-on experience building scalable, maintainable web applications using TypeScript, React, Next.js, and Tailwind CSS ✅ Strong skills in converting Figma designs into pixel-perfect, responsive user interfaces ✅ Comfortable working with RESTful APIs and integrating frontend with backend systems ✅ Experience using AI coding tools to boost productivity ✅ Excellent communication skills and a self-starter attitude",1 hr. ago,https://www.reddit.com/r/WebDeveloperJobs/comments/1mi63eq/hiring_full_stack_developer_typescript_react/,r/WebDeveloperJobs,2025-08-05T15:31:38.803864
Looking for a Web Developer,"We are currently looking for a talented web developer to help bring one of our projects to life. Compensation will depend on your experience and your ability to turn our ideas into reality. This is a one-project opportunity to start, but we have several more lined up. If things go well and you prove yourself on this first one, we’d be happy to continue working together long-term. I know my DMs will probably get flooded after this, but let’s try to keep things organized. Please send clear and transparent messages along with your portfolio. I’ll review every single one and reach out to those who seem like the best fit. Looking forward to hearing from everyone!",17 days ago,https://www.reddit.com/r/WebDeveloperJobs/comments/1m3rp1s/looking_for_a_web_developer/,r/WebDeveloperJobs,2025-08-05T15:31:38.919916
[Hiring] Bakery Website - Really Small.,"Hey everyone, I am trying to have a bakery website made. It's simplistic, well... hopefully, there is only 1 product at the moment. It's should be easy to check out and buy the products from the opening page, so I don't think this will be more than 5 pages, including some small features or needed disclaimers. I have content and pictures readily available for project as well and a base website I already attempted making to discuss things from there. I want to be clear, I am not looking to be the apple of bakeries or even the Martha Stewart or anything. I want something solid that works, that is expansive if need be, and allows me to sell my cakes soon. If this interest you we can negotiate rates and what it would take to get this job done. If everything goes well I would love to expand the partnership as more work is needed and maintenance. Lastly, if this interest please email me at in your email for your header please place [Reddit, Website] so I know you read this and post any of your past work or portfolio, with hopeful citations of your work on the website in your email. Please do not send a message here, I will not see it.",18 hr. ago,https://www.reddit.com/r/WebDeveloperJobs/comments/1mhkxeg/hiring_bakery_website_really_small/,r/WebDeveloperJobs,2025-08-05T15:31:39.019256
"Developer – Python (FastAPI) & Next.js – Remote – ₹15,000/month – India Only","Hey folks! We’re a small but growing product/dev agency looking for an affordable, enthusiastic developer to join our team. If you have experience with Python (FastAPI) and Next.js (React), and you’re looking for a consistent, part-time (or junior full-time) gig, this could be for you. What We’re Looking For Solid hands-on experience in: Python (FastAPI) Next.js (React) Able to work remotely (anywhere in India) Good with Git, basic REST APIs, and modern dev tools Quick learner, responsible, able to communicate in English/Hindi About the Role Work: Help us build and maintain SaaS MVPs and web platforms Commitment: 7 hours / day Compensation: ₹15,000 INR/month (fixed – we know it’s not huge, but this is a real, stable remote role, with scope to grow if you deliver!)",58 min. ago,https://www.reddit.com/r/WebDeveloperJobs/comments/1mi6ox6/developer_python_fastapi_nextjs_remote_15000month/,r/WebDeveloperJobs,2025-08-05T15:31:39.120065
We are looking for a webdeveloper,"Hello, We're a Cybersecurity company and is looking to build a website ( service ) for $600-$1000. We're thinking of developing one as in awwwards.com ultra modern style, with super good SEO and admin panels where we can publish stuff [Hiring][Remote]",1 day ago,https://www.reddit.com/r/WebDeveloperJobs/comments/1mh6sh1/we_are_looking_for_a_webdeveloper/,r/WebDeveloperJobs,2025-08-05T15:31:39.224058
FullStack Developer. Need Advice.,"How much should I charge for my services, software development (Full-Stack). I'm just getting started and I need advice on reaching clients. My goal for this month is to make at least around 500$. Give me advice on how I should find/approach clients, and how much I should charge or how I should calculate how much to charge. I'm a native English speaker with about a year and a half of experience in a professional environment. But many more years of general experience. Thank you. Feel free to ask questions regarding my experience.",2 hr. ago,https://www.reddit.com/r/WebDeveloperJobs/comments/1mi573g/fullstack_developer_need_advice/,r/WebDeveloperJobs,2025-08-05T15:31:39.306557
Looking for a Wordpress developer,"I’m looking for a Wordpress developer who also has some experience in copy/design. I will be providing the creative direction but you need to have a good sense of design and copy. I need an exact clone of an existing Wordpress site but with my content(text, images, logo and other assets) It is 7 pages static website. Real estate website. DM your project cost, timeline and mode of communication.",5 days ago,https://www.reddit.com/r/WebDeveloperJobs/comments/1me9nfb/looking_for_a_wordpress_developer/,r/WebDeveloperJobs,2025-08-05T15:31:39.423007
what comes after discovery phase in Software development?,One of our clients is currently looking for a Discovery Phase for their software development project. Can you share your experience on what exactly the company offers after the Discovery Phase in Agile?,2 hr. ago,https://www.reddit.com/r/WebDeveloperJobs/comments/1mi5c6k/what_comes_after_discovery_phase_in_software/,r/WebDeveloperJobs,2025-08-05T15:31:39.534867
"Looking for an app developer, for long term projects","I run a bootstrapped software studio, where we build apps for clients and inhouse apps as well. I'm looking for a builder (doesn't matter if you're a college student or a recent graduate) to join and help on a project. We will start off with 1 project and if it goes well then this will turn into a long term partnership. This is a 100% paid opportunity. Please comment if you're interested, I'll reach out with more details.",10 days ago,https://www.reddit.com/r/WebDeveloperJobs/comments/1m9n7vh/looking_for_an_app_developer_for_long_term/,r/WebDeveloperJobs,2025-08-05T15:31:39.622515
[Hiring] [Remote] [CET plus or minus 3 HOURS] - Senior Next.js Developer at Proxify (💸 $40k - $75k),Proxify is hiring a remote Senior Next.js Developer. Category: Software Development 💸Salary: $40k - $75k 📍Location: Remote (CET +/- 3 HOURS) See more and apply here!,19 hr. ago,https://www.reddit.com/r/WebDeveloperJobs/comments/1mhjtdv/hiring_remote_cet_plus_or_minus_3_hours_senior/,r/WebDeveloperJobs,2025-08-05T15:31:39.736691
Hiring 1-5+ exp software engineers (Freshers also welcome)- India,Hi we are hiring 1-5+ experienced software engineers in India any location. If you feel you are good problem solver in any tech stack please dm me. Team will call you. Regards,6 days ago,https://www.reddit.com/r/WebDeveloperJobs/comments/1mdi19u/hiring_15_exp_software_engineers_freshers_also/,r/WebDeveloperJobs,2025-08-05T15:31:39.834505
"Web Developer (2 YOE) Looking for Job Opportunities – React, Java, SQL","Hi Reddit! I’m a 22-year-old web developer with 2 years of experience, currently looking for job opportunities in web development. Here’s a quick overview of my skills: Frontend: HTML, CSS, JavaScript, React Backend: Java (Spring Boot) Database: MySQL, PostgreSQL Others: Git, REST APIs, basic deployment & debugging I’ve worked on both personal and team projects, and I’m comfortable building full-stack applications. I’m passionate about clean code, responsive UI, and performance optimization. I’m open to: Full-time or remote jobs Junior/mid-level roles (open to learning and growing fast) If you know of any opportunities, or if you're building something and need an extra pair of hands — I’d love to connect!",20 hr. ago,https://www.reddit.com/r/WebDeveloperJobs/comments/1mhikt0/web_developer_2_yoe_looking_for_job_opportunities/,r/WebDeveloperJobs,2025-08-05T15:31:40.045037
Let me know if you need a web developer,"Hi there! I'm a relatively low cost web developer with experience in a variety of technologies, and I can provide testimonials and examples of my work if needed. Please do let me know if you need somebody to bring your idea to life, you can just DM me, and I'll be more than happy to do so. Thanks!",1 day ago,https://www.reddit.com/r/WebDeveloperJobs/comments/1mhaqhx/let_me_know_if_you_need_a_web_developer/,r/WebDeveloperJobs,2025-08-05T15:31:40.149254
[Looking for a full stack developer],Need a full stack developer for a project Pls drop ur previous work,19 days ago,https://www.reddit.com/r/WebDeveloperJobs/comments/1m2ghoy/looking_for_a_full_stack_developer/,r/WebDeveloperJobs,2025-08-05T15:31:40.270076
[Hiring] Web Developer Needed to Build Real-Time Booking,"Hi everyone, I'm hiring a web developer to build a real-time last minute booking directory platform. This is the MVP for a high-demand wellness niche (primarily Massage Therapists and clinics), with the goal to onboard providers. Vendor Account Creation + Authentication Simple sign-up with email + magic link Profile setup: name, business name, address, service category",10 days ago,https://www.reddit.com/r/WebDeveloperJobs/comments/1m9o3jx/hiring_web_developer_needed_to_build_realtime/,r/WebDeveloperJobs,2025-08-05T15:31:40.391851
[Hiring] Software Development Agency – NextJS + Supabase + Payment Integration,"Hey everyone, We're looking to hire a skilled software development agency from India to help us enhance and scale our live beta product. Expertise: NextJS, Supabase, Payment gateway integration DM me for more info",15 days ago,https://www.reddit.com/r/WebDeveloperJobs/comments/1m5f8ay/hiring_software_development_agency_nextjs/,r/WebDeveloperJobs,2025-08-05T15:31:40.479592
Urgent help: Looking for a frontend developer job,"I am going through some extreme financial issues, will be really happy if u guys can help me find a job or internship i cant even pay my daily expenses. Will be really happy if u can guys can suggest platforms or hire me. I am Highly skilled in frontend Skills: html css js and react js I have done internship at riso I do have some knowledge of mern stack but i cant mention bcz i am not that expert in backend For now i will be really happy if u guys can help me out by suggesting platforms or companies which are hiring sde interns. My github: https://github.com/Jatin-sharma01",1 day ago,https://www.reddit.com/r/WebDeveloperJobs/comments/1mh8xba/urgent_help_looking_for_a_frontend_developer_job/,r/WebDeveloperJobs,2025-08-05T15:31:40.572925
Hiring Backend Dev,Looking to hire a backend developer for the following tasks: Create an API to generate Agora Video + RTM tokens for mobile app use. Build a Join page that opens a separate web page with Agora Video Call + RTM Chat SDK integrated. Add a Share Link feature — clicking it should open the video call in a browser (mobile-friendly).,3 hr. ago,https://www.reddit.com/r/AppDevelopers/comments/1mi50yk/hiring_backend_dev/,r/AppDevelopers,2025-08-05T15:31:50.629100
"Looking for an app developer, for long term projects","I run a bootstrapped software studio, where we build apps for clients and inhouse apps as well. I'm looking for a builder (doesn't matter if you're a college student or a recent graduate) to join and help on a project. We will start off with 1 project and if it goes well then this will turn into a long term partnership. This is a 100% paid opportunity. Please comment if you're interested, I'll reach out with more details.",10 days ago,https://www.reddit.com/r/AppDevelopers/comments/1m9n7nc/looking_for_an_app_developer_for_long_term/,r/AppDevelopers,2025-08-05T15:31:50.719132
[Hiring] Full Stack Developer - India / LATAM,"Hi! I'm looking for a talented Frontend Developer with 3-5 years of experience in TypeScript, React, Next.js, and Tailwind CSS for a full-time role. Ideal Candidate ✅ 3-5 years of hands-on experience building scalable, maintainable web applications using TypeScript, React, Next.js, and Tailwind CSS ✅ Strong skills in converting Figma designs into pixel-perfect, responsive user interfaces ✅ Comfortable working with RESTful APIs and integrating frontend with backend systems ✅ Experience using AI coding tools to boost productivity ✅ Excellent communication skills and a self-starter attitude",1 hr. ago,https://www.reddit.com/r/AppDevelopers/comments/1mi6fb4/hiring_full_stack_developer_india_latam/,r/AppDevelopers,2025-08-05T15:31:50.818684
Looking for Developer?,"Hi everyone, I’m in the very early stages of designing an app and would love the help of a real developer. It’s a delivery/courier app so anyone with experience in building apps in those areas, would be greatly encouraged and appreciated!",4 days ago,https://www.reddit.com/r/AppDevelopers/comments/1mfbby2/looking_for_developer/,r/AppDevelopers,2025-08-05T15:31:50.912841
Looking for Developer to Help Build Clothing Social Media Platform.,"I’m looking for a developer to help build a social media app focused around all things streetwear and other similar clothing. I've been working on the UI side in Figma and so can handle most of that although any experience/tips in it would be greatly appreciated. You’d handle the development side. This could be freelance or a longer-term collaboration. Would be great to discuss all this in detail even just for some advice. If you're into fashion, streetwear, or just want to help build something cool, DM me. Thanks!",19 hr. ago,https://www.reddit.com/r/AppDevelopers/comments/1mhjli3/looking_for_developer_to_help_build_clothing/,r/AppDevelopers,2025-08-05T15:31:51.014458
