title,description,time_posted,url,subreddit,scraped_at
"[Hiring] Full Stack Developer (TypeScript, React, Next.js, Tailwind) based in India / LATAM","Hi! I'm looking for a talented Frontend Developer with 3-5 years of experience in TypeScript, React, Next.js, and Tailwind CSS for a full-time role. Ideal Candidate ✅ 3-5 years of hands-on experience building scalable, maintainable web applications using TypeScript, React, Next.js, and Tailwind CSS ✅ Strong skills in converting Figma designs into pixel-perfect, responsive user interfaces ✅ Comfortable working with RESTful APIs and integrating frontend with backend systems ✅ Experience using AI coding tools to boost productivity ✅ Excellent communication skills and a self-starter attitude",1 hr. ago,https://www.reddit.com/r/WebDeveloperJobs/comments/1mi63eq/hiring_full_stack_developer_typescript_react/,r/WebDeveloperJobs,2025-08-05T15:19:34.124101
Looking for a Web Developer,"We are currently looking for a talented web developer to help bring one of our projects to life. Compensation will depend on your experience and your ability to turn our ideas into reality. This is a one-project opportunity to start, but we have several more lined up. If things go well and you prove yourself on this first one, we’d be happy to continue working together long-term. I know my DMs will probably get flooded after this, but let’s try to keep things organized. Please send clear and transparent messages along with your portfolio. I’ll review every single one and reach out to those who seem like the best fit. Looking forward to hearing from everyone!",17 days ago,https://www.reddit.com/r/WebDeveloperJobs/comments/1m3rp1s/looking_for_a_web_developer/,r/WebDeveloperJobs,2025-08-05T15:19:34.216486
[Hiring] Bakery Website - Really Small.,"Hey everyone, I am trying to have a bakery website made. It's simplistic, well... hopefully, there is only 1 product at the moment. It's should be easy to check out and buy the products from the opening page, so I don't think this will be more than 5 pages, including some small features or needed disclaimers. I have content and pictures readily available for project as well and a base website I already attempted making to discuss things from there. I want to be clear, I am not looking to be the apple of bakeries or even the Martha Stewart or anything. I want something solid that works, that is expansive if need be, and allows me to sell my cakes soon. If this interest you we can negotiate rates and what it would take to get this job done. If everything goes well I would love to expand the partnership as more work is needed and maintenance. Lastly, if this interest please email me at in your email for your header please place [Reddit, Website] so I know you read this and post any of your past work or portfolio, with hopeful citations of your work on the website in your email. Please do not send a message here, I will not see it.",18 hr. ago,https://www.reddit.com/r/WebDeveloperJobs/comments/1mhkxeg/hiring_bakery_website_really_small/,r/WebDeveloperJobs,2025-08-05T15:19:34.302295
"Developer – Python (FastAPI) & Next.js – Remote – ₹15,000/month – India Only","Hey folks! We’re a small but growing product/dev agency looking for an affordable, enthusiastic developer to join our team. If you have experience with Python (FastAPI) and Next.js (React), and you’re looking for a consistent, part-time (or junior full-time) gig, this could be for you. What We’re Looking For Solid hands-on experience in: Python (FastAPI) Next.js (React) Able to work remotely (anywhere in India) Good with Git, basic REST APIs, and modern dev tools Quick learner, responsible, able to communicate in English/Hindi About the Role Work: Help us build and maintain SaaS MVPs and web platforms Commitment: 7 hours / day Compensation: ₹15,000 INR/month (fixed – we know it’s not huge, but this is a real, stable remote role, with scope to grow if you deliver!)",46 min. ago,https://www.reddit.com/r/WebDeveloperJobs/comments/1mi6ox6/developer_python_fastapi_nextjs_remote_15000month/,r/WebDeveloperJobs,2025-08-05T15:19:34.395815
We are looking for a webdeveloper,"Hello, We're a Cybersecurity company and is looking to build a website ( service ) for $600-$1000. We're thinking of developing one as in awwwards.com ultra modern style, with super good SEO and admin panels where we can publish stuff [Hiring][Remote]",1 day ago,https://www.reddit.com/r/WebDeveloperJobs/comments/1mh6sh1/we_are_looking_for_a_webdeveloper/,r/WebDeveloperJobs,2025-08-05T15:19:34.484332
Looking for a Wordpress developer,"I’m looking for a Wordpress developer who also has some experience in copy/design. I will be providing the creative direction but you need to have a good sense of design and copy. I need an exact clone of an existing Wordpress site but with my content(text, images, logo and other assets) It is 7 pages static website. Real estate website. DM your project cost, timeline and mode of communication.",5 days ago,https://www.reddit.com/r/WebDeveloperJobs/comments/1me9nfb/looking_for_a_wordpress_developer/,r/WebDeveloperJobs,2025-08-05T15:19:34.599586
what comes after discovery phase in Software development?,One of our clients is currently looking for a Discovery Phase for their software development project. Can you share your experience on what exactly the company offers after the Discovery Phase in Agile?,2 hr. ago,https://www.reddit.com/r/WebDeveloperJobs/comments/1mi5c6k/what_comes_after_discovery_phase_in_software/,r/WebDeveloperJobs,2025-08-05T15:19:34.716171
"Looking for an app developer, for long term projects","I run a bootstrapped software studio, where we build apps for clients and inhouse apps as well. I'm looking for a builder (doesn't matter if you're a college student or a recent graduate) to join and help on a project. We will start off with 1 project and if it goes well then this will turn into a long term partnership. This is a 100% paid opportunity. Please comment if you're interested, I'll reach out with more details.",10 days ago,https://www.reddit.com/r/WebDeveloperJobs/comments/1m9n7vh/looking_for_an_app_developer_for_long_term/,r/WebDeveloperJobs,2025-08-05T15:19:34.817412
[Hiring] [Remote] [CET plus or minus 3 HOURS] - Senior Next.js Developer at Proxify (💸 $40k - $75k),Proxify is hiring a remote Senior Next.js Developer. Category: Software Development 💸Salary: $40k - $75k 📍Location: Remote (CET +/- 3 HOURS) See more and apply here!,19 hr. ago,https://www.reddit.com/r/WebDeveloperJobs/comments/1mhjtdv/hiring_remote_cet_plus_or_minus_3_hours_senior/,r/WebDeveloperJobs,2025-08-05T15:19:34.903636
"Web Developer (2 YOE) Looking for Job Opportunities – React, Java, SQL","Hi Reddit! I’m a 22-year-old web developer with 2 years of experience, currently looking for job opportunities in web development. Here’s a quick overview of my skills: Frontend: HTML, CSS, JavaScript, React Backend: Java (Spring Boot) Database: MySQL, PostgreSQL Others: Git, REST APIs, basic deployment & debugging I’ve worked on both personal and team projects, and I’m comfortable building full-stack applications. I’m passionate about clean code, responsive UI, and performance optimization. I’m open to: Full-time or remote jobs Junior/mid-level roles (open to learning and growing fast) If you know of any opportunities, or if you're building something and need an extra pair of hands — I’d love to connect!",20 hr. ago,https://www.reddit.com/r/WebDeveloperJobs/comments/1mhikt0/web_developer_2_yoe_looking_for_job_opportunities/,r/WebDeveloperJobs,2025-08-05T15:19:35.005837
Hiring 1-5+ exp software engineers (Freshers also welcome)- India,Hi we are hiring 1-5+ experienced software engineers in India any location. If you feel you are good problem solver in any tech stack please dm me. Team will call you. Regards,6 days ago,https://www.reddit.com/r/WebDeveloperJobs/comments/1mdi19u/hiring_15_exp_software_engineers_freshers_also/,r/WebDeveloperJobs,2025-08-05T15:19:35.095599
Let me know if you need a web developer,"Hi there! I'm a relatively low cost web developer with experience in a variety of technologies, and I can provide testimonials and examples of my work if needed. Please do let me know if you need somebody to bring your idea to life, you can just DM me, and I'll be more than happy to do so. Thanks!",1 day ago,https://www.reddit.com/r/WebDeveloperJobs/comments/1mhaqhx/let_me_know_if_you_need_a_web_developer/,r/WebDeveloperJobs,2025-08-05T15:19:35.188721
Urgent help: Looking for a frontend developer job,"I am going through some extreme financial issues, will be really happy if u guys can help me find a job or internship i cant even pay my daily expenses. Will be really happy if u can guys can suggest platforms or hire me. I am Highly skilled in frontend Skills: html css js and react js I have done internship at riso I do have some knowledge of mern stack but i cant mention bcz i am not that expert in backend For now i will be really happy if u guys can help me out by suggesting platforms or companies which are hiring sde interns. My github: https://github.com/Jatin-sharma01",1 day ago,https://www.reddit.com/r/WebDeveloperJobs/comments/1mh8xba/urgent_help_looking_for_a_frontend_developer_job/,r/WebDeveloperJobs,2025-08-05T15:19:35.287630
FullStack Developer. Need Advice.,"How much should I charge for my services, software development (Full-Stack). I'm just getting started and I need advice on reaching clients. My goal for this month is to make at least around 500$. Give me advice on how I should find/approach clients, and how much I should charge or how I should calculate how much to charge. I'm a native English speaker with about a year and a half of experience in a professional environment. But many more years of general experience. Thank you. Feel free to ask questions regarding my experience.",2 hr. ago,https://www.reddit.com/r/WebDeveloperJobs/comments/1mi573g/fullstack_developer_need_advice/,r/WebDeveloperJobs,2025-08-05T15:19:35.378697
Web Developer Ready to Start IMMEDIATELY - Need Projects!,"CS Student with real experience looking for web development work. I can start your project this week. My Background: ✅ Database experience - Built systems for insurance companies (user registration, data management) ✅ MERN Stack - MongoDB, Express, React, Node.js ✅ Full-stack development - Frontend + Backend + Database ✅ Professional projects - Not just student exercises What I Build: 🌐 Business websites with custom functionality 💼 Web applications with user authentication 🛒 E-commerce solutions 📊 Admin dashboards and data management 📱 Responsive, mobile-first designs Why Hire Me: Available immediately - Student schedule = flexible hours Experienced with secure data handling (insurance sector background) Modern tech stack - No outdated methods Fair pricing - €25-30/hour or project-based quotes German work ethic - Reliable and thorough",1 day ago,https://www.reddit.com/r/WebDeveloperJobs/comments/1mh46zi/web_developer_ready_to_start_immediately_need/,r/WebDeveloperJobs,2025-08-05T15:19:35.485315
Hiring Full Stack Developer Interns (MERN) up to $3k/month,"Apply Here We're on the hunt for a tech-savvy individual with a passion for coding and a drive to learn and grow. As a Full Stack Developer Intern, you'll be working with our development team to build and maintain web applications, both on the front-end and back-end. You'll be focusing on the dashboard for our clients, integration with ATS and new features in the app for our community. Skills You'll Need to Bring: Strong knowledge of web development and coding principles. Familiarity with modern front-end frameworks (such as React) and back-end technologies (such as Node.js).",2 days ago,https://www.reddit.com/r/WebDeveloperJobs/comments/1mgkjs2/hiring_full_stack_developer_interns_mern_up_to/,r/WebDeveloperJobs,2025-08-05T15:19:35.594226
[HIRING] - Senior Full-Stack Developer - Update Music Marketing Platform (T3 Stack + Turborepo),"We're disrupting the $16 billion music marketing industry and need a senior full-stack developer to help update our entire platform. This isn't just a contract gig - it's a potential pathway to a full-time, high-impact role at an investor-backed startup. What Makes This Different: You'll work directly with the founders (myself + 2 growth-focused co-founders) to architect and build something that actually matters. No layers of management, no corporate bureaucracy - just focused development on a platform that's already gaining serious traction. The Challenge: We're updating our platform in 4-6 weeks (targeting early September). It's ambitious, but we have clear requirements, solid architecture decisions, and founders who understand what it takes to ship quality code fast.",7 days ago,https://www.reddit.com/r/WebDeveloperJobs/comments/1mcdcfq/hiring_senior_fullstack_developer_update_music/,r/WebDeveloperJobs,2025-08-05T15:19:35.689994
"[FOR HIRE] Full-Stack Web Developer – .NET Core, React, Node.js, PostgreSQL, MSSQL | Open to New Stacks","Hi everyone! I'm a web developer with solid experience in .NET Core (C#), React, Node.js, PostgreSQL, and MSSQL. I’ve been building full-stack applications and backend services for several years and am confident working on both new and existing projects. 🔧 Skills & Technologies: Backend: .NET Core (C#), Node.js, REST APIs Frontend: React (Hooks, Context), HTML, CSS, JavaScript Databases: PostgreSQL, MSSQL",8 days ago,https://www.reddit.com/r/WebDeveloperJobs/comments/1mbshk9/for_hire_fullstack_web_developer_net_core_react/,r/WebDeveloperJobs,2025-08-05T15:19:35.796805
Hiring Backend Dev,Looking to hire a backend developer for the following tasks: Create an API to generate Agora Video + RTM tokens for mobile app use. Build a Join page that opens a separate web page with Agora Video Call + RTM Chat SDK integrated. Add a Share Link feature — clicking it should open the video call in a browser (mobile-friendly).,2 hr. ago,https://www.reddit.com/r/AppDevelopers/comments/1mi50yk/hiring_backend_dev/,r/AppDevelopers,2025-08-05T15:19:46.649078
"Looking for an app developer, for long term projects","I run a bootstrapped software studio, where we build apps for clients and inhouse apps as well. I'm looking for a builder (doesn't matter if you're a college student or a recent graduate) to join and help on a project. We will start off with 1 project and if it goes well then this will turn into a long term partnership. This is a 100% paid opportunity. Please comment if you're interested, I'll reach out with more details.",10 days ago,https://www.reddit.com/r/AppDevelopers/comments/1m9n7nc/looking_for_an_app_developer_for_long_term/,r/AppDevelopers,2025-08-05T15:19:46.742356
[Hiring] Full Stack Developer - India / LATAM,"Hi! I'm looking for a talented Frontend Developer with 3-5 years of experience in TypeScript, React, Next.js, and Tailwind CSS for a full-time role. Ideal Candidate ✅ 3-5 years of hands-on experience building scalable, maintainable web applications using TypeScript, React, Next.js, and Tailwind CSS ✅ Strong skills in converting Figma designs into pixel-perfect, responsive user interfaces ✅ Comfortable working with RESTful APIs and integrating frontend with backend systems ✅ Experience using AI coding tools to boost productivity ✅ Excellent communication skills and a self-starter attitude",1 hr. ago,https://www.reddit.com/r/AppDevelopers/comments/1mi6fb4/hiring_full_stack_developer_india_latam/,r/AppDevelopers,2025-08-05T15:19:46.859082
Looking for Developer?,"Hi everyone, I’m in the very early stages of designing an app and would love the help of a real developer. It’s a delivery/courier app so anyone with experience in building apps in those areas, would be greatly encouraged and appreciated!",4 days ago,https://www.reddit.com/r/AppDevelopers/comments/1mfbby2/looking_for_developer/,r/AppDevelopers,2025-08-05T15:19:46.954923
Looking for Developer to Help Build Clothing Social Media Platform.,"I’m looking for a developer to help build a social media app focused around all things streetwear and other similar clothing. I've been working on the UI side in Figma and so can handle most of that although any experience/tips in it would be greatly appreciated. You’d handle the development side. This could be freelance or a longer-term collaboration. Would be great to discuss all this in detail even just for some advice. If you're into fashion, streetwear, or just want to help build something cool, DM me. Thanks!",19 hr. ago,https://www.reddit.com/r/AppDevelopers/comments/1mhjli3/looking_for_developer_to_help_build_clothing/,r/AppDevelopers,2025-08-05T15:19:47.044983
App developer Needed,"We are seeking a qualified developer or development team to assist in building a lead generation application tailored to the service industry. The app will be designed to streamline the process of identifying and capturing high-quality leads. Additional project details, including scope and functionality, will be provided upon further discussion. If you're interested, please reach out to initiate the conversation.",22 days ago,https://www.reddit.com/r/AppDevelopers/comments/1lzvq1u/app_developer_needed/,r/AppDevelopers,2025-08-05T15:19:47.157586
Does anyone know where I can freelance a cheap app developer,"I have an idea for an app and I want to find some website where someone can make an app for me, I’ve been thinking about this project for a while but don’t know the first thing about coding so I need help. I’m scared to use AI for my app in case it blows up and then the website I used can own my original idea",19 hr. ago,https://www.reddit.com/r/AppDevelopers/comments/1mhiwsv/does_anyone_know_where_i_can_freelance_a_cheap/,r/AppDevelopers,2025-08-05T15:19:47.235956
Looking for App Developer,"Hello! I just graduated from the University of Wisconsin and have been building my app Nomad for the past 8 months. The Figma design is nearly complete, the prototype was built and launched on test flight by another developer, and now I am looking for a co-founder to be my new partner. Nomad is an application that allows users to choose travel activities based on recommendations and tips from people in their direct network. Similar to beli - but for all travel recs. Starting with the target market of students studying abroad. Please reach out if you are interested in learning more!",5 days ago,https://www.reddit.com/r/AppDevelopers/comments/1me3r9x/looking_for_app_developer/,r/AppDevelopers,2025-08-05T15:19:47.333598
Looking for a App Developer,"We are a Edutech startup looking for a app developer. We need to launch our MVP education app. Need good design for the App. Looking for Developers, freshers are also welcome. Please DM.",12 days ago,https://www.reddit.com/r/AppDevelopers/comments/1m84i3m/looking_for_a_app_developer/,r/AppDevelopers,2025-08-05T15:19:47.484597
Full Stack Dev needed for MVP build - Equity based!,"Hey there - i’m looking for a full stack developer to build an MVP with around 8–10 pages. Timeline is 4 weeks. Very fast paced communication needed. This is a fixed non-voting equity opportunity, with the option to stay on as paid technical lead after funding is secured. DM for details. Thanks so much!",7 days ago,https://www.reddit.com/r/AppDevelopers/comments/1mch7tk/full_stack_dev_needed_for_mvp_build_equity_based/,r/AppDevelopers,2025-08-05T15:19:47.622517
Need a real app developer 🧑‍💻,"Are there any real app developers that already published at least 1 app on the iPhone Apple store and are willing to help me with building my unique dating app at a low cost that I can afford for now ? Willing to pay the developer after the app gains its popularity continuously. Give the developer credit on the app and everywhere ! If the app really gets functional and makes $ which I’m sure it will, I could split the founder income with the developer income in 1/2 ! I already have the app set up, started it, just need a tech person to get it function 🧑‍💻🧑‍💻🧑‍💻🙏🙏🙏anyone with a heart ♥️ out there ? 🧑‍💻♥️let’s get this unique dating app on the App Store together ♥️🙏",5 days ago,https://www.reddit.com/r/AppDevelopers/comments/1mebjyw/need_a_real_app_developer/,r/AppDevelopers,2025-08-05T15:19:47.765437
Looking for a developer/co-founder,This is NOT a paid role from the get go. So all of you hoping to outsource this work to fiverr don’t bother. I am looking for a developer and co founder to help build me an app similar to any dating app. Just a simple swipe and match app. It is not in the dating niche though. I will handle everything business about it from marketing to investment. I just need a developer who is willing and passionate about their job. Contracts will be drawn. Split will be 50/50. This project has huge potential so message me if you are interested.,2 days ago,https://www.reddit.com/r/AppDevelopers/comments/1mgo1xl/looking_for_a_developercofounder/,r/AppDevelopers,2025-08-05T15:19:47.858594
Looking for app developers,I am looking for app and website developers for something that I am building for Indian farmers. This is a paid opportunity and I want very serious people who are genuinely passionate about coding and development. Please connect with me with your portfolio so that we can discuss it further.,9 days ago,https://www.reddit.com/r/AppDevelopers/comments/1macmrn/looking_for_app_developers/,r/AppDevelopers,2025-08-05T15:19:47.956175
I'm live-streaming how I build iOS apps fast and will be sharing my full development process as a senior engineer,"links: session 1, session 2 I’ve been building apps for startups and businesses for over 6 years now through my own development agency. Over time, I’ve become known for delivering high-quality apps quickly and affordably — and now I want to share exactly how I do it. So I’m going to be live-streaming my full app development process on YouTube — from planning and architecture to writing clean, scalable code for iOS, Android, and the web. This isn’t just a build-in-public thing — I’ll be explaining my thought process, how I break down features, structure the codebase for growth, and all the tools and shortcuts I use to build fast. It’s totally free — just something I wish I had when I was starting out.",17 days ago,https://www.reddit.com/r/AppDevelopers/comments/1m4apga/im_livestreaming_how_i_build_ios_apps_fast_and/,r/AppDevelopers,2025-08-05T15:19:48.049636
Need a developer,"Hi, I need an app developer for a freight forwarding service. DM me with your portfolio for more details",14 days ago,https://www.reddit.com/r/AppDevelopers/comments/1m6d3tg/need_a_developer/,r/AppDevelopers,2025-08-05T15:19:48.156798
Looking for a App developer,We are an edutech startup looking to build a founding members in the product development side. Actually we are in search of a app developer both frontend and backend to build our mvp application. To bo frank this is a unpaid project like an internship. Looking for entrepreneur minded peop who knows app development. You will be joining our team from this early stage it self and we expect to give you good package and oppertunities in near future if the idea just works. Currently we are having an excellent edutech idea which is proven. We just need to make our works(especially whatsapp way communication with parents) automated with this app. This an inital stage where a basic simple app required.,7 days ago,https://www.reddit.com/r/AppDevelopers/comments/1mc22mt/looking_for_a_app_developer/,r/AppDevelopers,2025-08-05T15:19:48.260362
App Developer Needed,"Hi! I am working on a project where I am building a lake water monitoring kit . I have the IOT device from which I connect through Bluetooth to an app. I made a small app with help of MIT app maker but I really need to make it with flutter and I don’t know that. The idea is we go once and twice and get the data from the IOT device to the app . I also have a physical kit which tells about certain compound via colour change of material. The idea is to bring both this data on one app, and then send it to cloud. We store it there, use it to make maps of lakes, and share the data with all. It’s a youth initiative ( so we don’t have much money now but we are looking at funding and the app will help a lot)",4 days ago,https://www.reddit.com/r/AppDevelopers/comments/1mf340j/app_developer_needed/,r/AppDevelopers,2025-08-05T15:19:48.359631
[Hiring] (Online) simple photo edits,Looking for a photo editor who can help with about 35 images. All I need done is to have a nail polish color changed in all images. I don’t need any other changes besides that. Need the color to look natural and not be sloppy or uneven/unnatural. Would need the photos back within 48 hours. Budget is between $20-$30 USD. Have had multiple people hired off Fiverr and all have messed up the request. Feel free to ask any clarifying questions. I can send the photos through a Google drive link. Contact me here in comments or DM.,5 hr. ago,https://www.reddit.com/r/forhire/comments/1mi2kgg/hiring_online_simple_photo_edits/,r/forhire,2025-08-05T15:19:57.018300
[Hiring] - Social Media Specialist ($31-$34/Hourly),"Fully Remote Job Opening 🚀 Role – Social Media Specialist Salary – $31 – $34/Hourly Location – Remote, United States About Company – Concorde Career Colleges is a U.S.-wide healthcare education provider offering vocational training—operating fully remote for corporate roles such as this social media position.",17 days ago,https://www.reddit.com/r/forhire/comments/1m3k7n7/hiring_social_media_specialist_3134hourly/,r/forhire,2025-08-05T15:19:57.119461
