title,description,time_posted,url,subreddit,scraped_at
Mistral ai interview: what is ML quiz (research ai engineer),,7 days ago,https://www.reddit.com/r/MachineLearningJobs/comments/1mtygsk/mistral_ai_interview_what_is_ml_quiz_research_ai/,r/MachineLearningJobs,2025-08-26 09:23:29.436760
[Hiring] [FullRemote] [US] 20 Machine Learning jobs,"I wanted to help you all to find jobs so made a list of most recent remote ML jobs. I hope this helps someone! AI Solutions Architect @ Splunk Senior Machine Learning Engineer @ Iterable 💰 $134–212K/y Machine Learning Engineer, Ads Training Platform @ Reddit 💰 $186–260K/y",7 days ago,https://www.reddit.com/r/MachineLearningJobs/comments/1mtwux6/hiring_fullremote_us_20_machine_learning_jobs/,r/MachineLearningJobs,2025-08-26 09:23:29.685774
[Remote] Mercor is hiring ML professionals ($75-$125 per hour),"Hello, I wanted to share this offer with you, which might interest ML experts. Mercor is hiring Machine Learning professionals (Remote | $75–$125/hr + bonuses). Responsibilities: Evaluate and improve ML outputs & pipelines Work on model design, training, and optimization Collaborate with top researchers & engineers Perks:",4 days ago,https://www.reddit.com/r/MachineLearningJobs/comments/1mxbz3e/remote_mercor_is_hiring_ml_professionals_75125/,r/MachineLearningJobs,2025-08-26 09:23:29.794939
(For Hire) AI/ML engineer,"Hello, I am an AI/ML engineer in python with 4+ years of industry experience. I have worked on multiple models/products/projects in all major domains. I have fine tuned stable diffusion models, created CVRMS, created multi agent systems, chatbots etc. I am fairly comfortable with pytorch, tensorflow. Deployed GCP functions, dataflow systems, deplyed models on aws lambda. Created pypi libraries Frequently use FastAPI and docker, and maintain version control. I write standardised clean reusable code. Charges: 10 to 20 dollars an hour based on complexity. Price is towards lower end for longer projects. CV available upon DM",3 days ago,https://www.reddit.com/r/MachineLearningJobs/comments/1mxiesa/for_hire_aiml_engineer/,r/MachineLearningJobs,2025-08-26 09:23:29.914656
We are looking for a webdeveloper,"Hello, We're a Cybersecurity company and is looking to build a website ( service ) for $600-$1000. We're thinking of developing one as in awwwards.com ultra modern style, with super good SEO and admin panels where we can publish stuff [Hiring][Remote]",22 days ago,https://www.reddit.com/r/WebDeveloperJobs/comments/1mh6sh1/we_are_looking_for_a_webdeveloper/,r/WebDeveloperJobs,2025-08-26 09:27:48.856987
[FOR HIRE] Web Developer | Years Experience | Affordable Rates | On-Time Delivery,"Hey everyone 👋 I’m a Web Developer with 3+ years of experience building and maintaining websites, web apps, and custom solutions. I’m currently available for new projects at your budget and can start right away. 🔹 What I Offer: Responsive, modern websites (HTML, CSS, JavaScript, React, Node.js) WordPress setup, customization & theme development Bug fixes, performance optimization, and redesigns E-commerce stores (Shopify, WooCommerce) API integrations and custom backend development 🔹 Why Work With Me: Flexible pricing (I’ll work within your budget) Fast turnaround times Clear communication & on-time delivery Strong experience working with small businesses, startups, and individuals",40 min. ago,https://www.reddit.com/r/WebDeveloperJobs/comments/1n0dsep/for_hire_web_developer_years_experience/,r/WebDeveloperJobs,2025-08-26 09:27:48.947191
Need A Frontend Developer,"I’m working on a project in my company and need an expert frontend developer, doesn’t matter if you haven’t worked with anyone, I just need to see if you have got any personal projects are proof of work. I want someone who’s young, ambitious, and serious to work. Friendly enough to be in a team. The pay is flexible. It will totally depend on the skills, time, and work you are willing to put. Feel free to comment and dm me.",2 days ago,https://www.reddit.com/r/WebDeveloperJobs/comments/1mybgon/need_a_frontend_developer/,r/WebDeveloperJobs,2025-08-26 09:27:49.084456
Offered $3/hour to build full backend and database over 3 months 🙂 is this normal?,"Hey everyone, I recently got an offer to work on a project where I’d be responsible for building the entire backend and database for a CRM system (Basically a complicated SaaS). It’s expected to take around 3 months, and the client offered $3 per hour. I’d be using NestJS and probably working with PostgreSQL, building things like authentication, API endpoints, user roles, and document handling essentially a CRM-like system with some accounting and document management features. For context, I have 3 years of experience with backend dev, and I can build this kind of thing with a some effort cause i'm new to NestJs (Not to NodeJS), but the rate feels extremely low for the amount of work and responsibility involved.",12 hr. ago,https://www.reddit.com/r/WebDeveloperJobs/comments/1mzyuhg/offered_3hour_to_build_full_backend_and_database/,r/WebDeveloperJobs,2025-08-26 09:27:49.198674
Senior full stack developer looking for a job.,"Senior Software Engineer with over 8 years of experience in full-stack development, delivering scalable, high-performance systems across diverse domains. Proven success in end-to-end feature delivery, from design to deployment, within agile and fast-paced environments. Adept at translating complex business requirements into clean, maintainable solutions. Experienced in working closely with cross-functional teams including product, design, and AI, contributing to rapid iteration cycles and continuous product improvement. Known for a strong execution mindset, attention to detail, and commitment to code quality and system reliability. I would be happy to discuss about any project or job. I am based in Hungary.",11 hr. ago,https://www.reddit.com/r/WebDeveloperJobs/comments/1mzzvwv/senior_full_stack_developer_looking_for_a_job/,r/WebDeveloperJobs,2025-08-26 09:27:49.306319
Looking for Frontend Developer,"Hey there! I'd love to team up with someone on a little hobby project of mine. I have a development background myself. It’s something with the potential to actually make money down the road. I’m pretty flexible when it comes to conditions. I’m happy to pay you, offer shares, or find a mix that works for both of us. The main thing is to have fun building something cool together while keeping the door open for it to grow into something bigger. If you enjoy frontend development, stay curious with new tech like AI, have built some hobby projects yourself, and love clean, tested code then let’s talk!",5 days ago,https://www.reddit.com/r/WebDeveloperJobs/comments/1mwfnma/looking_for_frontend_developer/,r/WebDeveloperJobs,2025-08-26 09:27:49.409943
Full-Stack Developer - 15-20k monthly stipend - 3 months - potential full-time,"Hiring for health tech startup. Looking for our second developer to join the team. Based out of Gurgaon, India. This is a remote role. Stack- Web: Next.js, TypeScript, TailwindCSS + shadcn/ui Mobile: React Native, StyleSheet, Expo Backend: Node.js, TypeScript, MongoDB If you’re interested please DM your GitHub/Resume/Portfolio.",7 days ago,https://www.reddit.com/r/WebDeveloperJobs/comments/1mueh13/fullstack_developer_1520k_monthly_stipend_3/,r/WebDeveloperJobs,2025-08-26 09:27:49.563463
Looking for a Developer for Web Tool Project,I’m looking to hire a developer to help build a simple web tool that processes social media links and outputs text. The site will need basic features like: Account creation & login Credit system / payment integration Handling single or bulk link inputs Generating text output,7 days ago,https://www.reddit.com/r/WebDeveloperJobs/comments/1mu66cq/looking_for_a_developer_for_web_tool_project/,r/WebDeveloperJobs,2025-08-26 09:27:49.745368
[For Hire] React + Node.js Full-Stack Web Developer | From $100 | Portfolio & Live Demos,"TL;DR: I build fast, secure, and maintainable web apps, landing pages, and websites using React, TypeScript, Node.js, and PostgreSQL. Portfolio & live demos → pritam.studio 💻 What I Offer (Packages) Portfolio / Simple Website — $100 / 2 days (Personal site, resume, blog, business showcase) Landing Page Build/Rebuild — $280 / 3 days (Boost leads & conversions with a modern responsive page)",19 hr. ago,https://www.reddit.com/r/WebDeveloperJobs/comments/1mznn1h/for_hire_react_nodejs_fullstack_web_developer/,r/WebDeveloperJobs,2025-08-26 09:27:49.930176
Need A Freelance Web Developer,Need A Next.js / Flutter / React Native developer. No min experience required but you should comment below your portfolio site or GitHub link and links to your previous projects. Please don’t spam into my DM🙃 reply here only with your link.,15 days ago,https://www.reddit.com/r/WebDeveloperJobs/comments/1mn8zag/need_a_freelance_web_developer/,r/WebDeveloperJobs,2025-08-26 09:27:50.106251
[For Hire] full stack software developer all tech stack knowledge,"hii everyone i am a full stack developer looking for a new gig i already have 4.5+years experience currently my 2 own products are live while 3rd one in mvp phase looking for a remote job in US, UK, Canada and Australia, please Indian cto and hiring team don't reach because i personally dont want work with indian clients due to past experiences please pm me if anyone like to discuss further",1 day ago,https://www.reddit.com/r/WebDeveloperJobs/comments/1mzgmkn/for_hire_full_stack_software_developer_all_tech/,r/WebDeveloperJobs,2025-08-26 09:27:50.295091
"Looking for an app developer, for long term projects","I run a bootstrapped software studio, where we build apps for clients and inhouse apps as well. I'm looking for a builder (doesn't matter if you're a college student or a recent graduate) to join and help on a project. We will start off with 1 project and if it goes well then this will turn into a long term partnership. This is a 100% paid opportunity. Please comment if you're interested, I'll reach out with more details.",1 mo. ago,https://www.reddit.com/r/WebDeveloperJobs/comments/1m9n7vh/looking_for_an_app_developer_for_long_term/,r/WebDeveloperJobs,2025-08-26 09:27:50.498615
[Hiring] Remote Full Stack Developer (Part-Time) | ~$0-2.5k+/mo),"Hello everyone, I'd like to briefly introduce myself. I'm Elia, CoFounder and CEO of a soon-to-be-launched digital growth agency in Switzerland. I'm here to find one of you who will take on a key role as the first remote employee in our agency. This is a part-time position where you'll have the chance to help shape the direction of the company from day one. We're looking for someone motivated and curious to work closely with us three co-founders to build our agency into a long-term, successful business - embracing all its goals, challenges, and opportunities. We're not just looking for someone to ""do the work"", instead we want someone who's excited to be part of developing this agency into something great, contributing ideas, and growing with us over time. We are looking for a full stack developer who can build fully functional and SEO-optimized websites in close collaboration with us, to be offered as part of our services to clients. Required are excellent theoretical and practical knowledge of HTML/CSS, JavaScript, UI/UX, and Webflow. Additional technical skills are welcome but not mandatory.",16 days ago,https://www.reddit.com/r/WebDeveloperJobs/comments/1mmersb/hiring_remote_full_stack_developer_parttime_025kmo/,r/WebDeveloperJobs,2025-08-26 09:27:50.610859
[HIRING] $5000 – Web Automation + API Project,"Looking for an experienced dev. Budget: $5000 (paid in milestones). Work: • Automate account creation + checkout flow on a site • Expose actions via API (usable on web/Telegram) • Handle OTP, sessions, errors, stability • Add crypto payment acceptance • Code should be easy to run (Docker) Requirements: • Strong automation background (Playwright / Puppeteer / Selenium) • Backend/API skills (Node.js or Python) • Past projects in account creation or auto-checkout • Fast, reliable, and able to show proof of work How to apply: Comment with your relevant experience and links to projects. I’ll DM shortlisted devs.",8 days ago,https://www.reddit.com/r/WebDeveloperJobs/comments/1mtcuqm/hiring_5000_web_automation_api_project/,r/WebDeveloperJobs,2025-08-26 09:27:50.707328
Looking For Freelance Gigs,"I’m a developer specializing in Python, FastAPI, RAG pipelines, MCP, and modern AI tool development. I help startups, businesses, and individuals build AI-driven products that are fast, reliable, and built on the right architecture. I work on: • Backend systems with Python and FastAPI • RAG pipelines and AI agent frameworks • Model integration, API development, and automation • for custom AI products",1 day ago,https://www.reddit.com/r/WebDeveloperJobs/comments/1mz6mdq/looking_for_freelance_gigs/,r/WebDeveloperJobs,2025-08-26 09:27:50.824782
Angular Developer with expertise in NestJs,"I’m a Software Engineer with 5.5 years of experience in data engineering, web development, and scalable software solutions. I'm highly proficient in Python, Go, Node.js, Angular, and Vue.js. Some key highlights from my work experience: I led the development of a Unified Trading API, integrating nine major broker platforms using Nest.js, which reduced response times by 30%. I designed and deployed scalable Go services on AWS, which helped a client reduce their company costs by 10%. I enhanced a SaaS platform by developing and launching over 15 new features using Angular and Nest.js, boosting user engagement by 20%. I pioneered a ride-matching system using Django and Redis which improved algorithm efficiency by 70%. I co-created a Kubernetes cluster to standardize on-premise deployments and revamped a legacy monolith into modular services, which improved deployment speed by 30%. I also implemented responsive Figma designs into a Laravel framework, increasing mobile usage by 15%. I'm an expert in translating complex UI/UX designs into responsive web components, and I have a strong focus on user experience. I also have experience with cloud technologies like GCP, Azure, and AWS. I am passionate about building intuitive and high-performance solutions. Let's connect!",2 days ago,https://www.reddit.com/r/WebDeveloperJobs/comments/1myz2z4/angular_developer_with_expertise_in_nestjs/,r/WebDeveloperJobs,2025-08-26 09:27:51.033119
"Looking for an app developer, for long term projects","I run a bootstrapped software studio, where we build apps for clients and inhouse apps as well. I'm looking for a builder (doesn't matter if you're a college student or a recent graduate) to join and help on a project. We will start off with 1 project and if it goes well then this will turn into a long term partnership. This is a 100% paid opportunity. Please comment if you're interested, I'll reach out with more details.",1 mo. ago,https://www.reddit.com/r/AppDevelopers/comments/1m9n7nc/looking_for_an_app_developer_for_long_term/,r/AppDevelopers,2025-08-26 09:28:00.014188
App Developer,"We urgently need help adapting our app for our product, the Smart Bait Boat. Unfortunately, the original app developer has let us down. We need to recreate the app with exactly the same functions, but remove the restrictions. The restrictions are: The autopilot is disabled by default and can be enabled via the app after purchase. The boat sends a request with its boat ID to a server. The server then sends back the status (activated = 1 or not activated = 0). All you need to do is redirect the server request internally in the app and set the status accordingly. We have the decompiled source files of the Android app. Please take a look at these first to see if you can work with them.",16 hr. ago,https://www.reddit.com/r/AppDevelopers/comments/1mzrqej/app_developer/,r/AppDevelopers,2025-08-26 09:28:00.664908
Need a food delivery app developer to work with a 7-year-old renowned restaurant (building our own Swiggy-style platform),"Hey Redit I'm 25F looking for an app developer must be from HYDERABAD, INDIA We run a 7-year-old restaurant loved for its homely meals. Our biggest challenge? Postpaid orders are draining us – chasing payments is eating more than our customers! So we’re going PREPAID and need our own system. What we’re looking for: A developer/freelancer/team to build a simple but solid ordering platform. Customers can browse our menu, pay upfront (UPI/cards/wallets), and track orders. Admin dashboard for us to manage menus, track orders, and get reports. Clean, fast, no Swiggy/Zomato middlemen. If you’ve built food apps, e-commerce, or POS systems before, we’d love to talk. Please DM if you're an app developer let's work together 🤝",18 hr. ago,https://www.reddit.com/r/AppDevelopers/comments/1mzomu1/need_a_food_delivery_app_developer_to_work_with_a/,r/AppDevelopers,2025-08-26 09:28:00.877597
Looking for App developer,"Hey everyone, I run a calisthenics YouTube channel called Benji Calisthenics (feel free to check me out). A while back, I created a simple 1-week PDF program that got 7,000 orders, and an 8-week follow-up program that got 200 paid orders at $20 each. Reviews were really positive, but honestly, PDFs felt limited—it’s basically just “do X reps, Y sets” with not much long-term value. I’ve been in calisthenics for over 6 years, and I know what I wish I had when I started. That’s why I want to build an app: a fun, intuitive, all-in-one tool for people’s calisthenics journey. Core MVP features I’d like to start with:",7 days ago,https://www.reddit.com/r/AppDevelopers/comments/1mui9ky/looking_for_app_developer/,r/AppDevelopers,2025-08-26 09:28:00.970204
Looking for App Developer,"Hello there everybody, I'm looking for App Developer for IOS and Android but IOS for just now is fine. looking for experienced people who have done app developing before ( dose not matter if your student) I'm looking into building a service app where people can book the service. You can be from anywhere and payments will be $1000+ and +bonus if a good job is done. Thanks everybody message if you want join us",14 days ago,https://www.reddit.com/r/AppDevelopers/comments/1mob7jc/looking_for_app_developer/,r/AppDevelopers,2025-08-26 09:28:01.067196
App Developer wanted - Paid Opportunity,"I am looking for an app developer that can create an ai integrated chat style app. I have a prototype (nonworking) on flutterflow. Flutterflow experience is a plus. The requirements are: Authentication, List style conversation history, able to upload images, AI integration. If interested please DM me with a link to your portfolio. US based developers preferred, potential for continued partnership for 2 other apps.",7 days ago,https://www.reddit.com/r/AppDevelopers/comments/1muifa3/app_developer_wanted_paid_opportunity/,r/AppDevelopers,2025-08-26 09:28:01.179768
Looking for app developers,I am looking for app and website developers for something that I am building for Indian farmers. This is a paid opportunity and I want very serious people who are genuinely passionate about coding and development. Please connect with me with your portfolio so that we can discuss it further.,1 mo. ago,https://www.reddit.com/r/AppDevelopers/comments/1macmrn/looking_for_app_developers/,r/AppDevelopers,2025-08-26 09:28:01.302623
Looking for a Flutter Developer,"I’m seeking a skilled Flutter developer to build a fresh academic ERP application from the ground up — similar to popular apps like Scholar ERP, Campus 360, CampusCare, Vidyalaya School ERP, Fedena, or School Diary. If you have experience developing ERP or educational apps and can deliver high-quality, scalable solutions, I’d love to connect. DM me with your portfolio and contact details",15 days ago,https://www.reddit.com/r/AppDevelopers/comments/1mna1jy/looking_for_a_flutter_developer/,r/AppDevelopers,2025-08-26 09:28:01.520253
"Looking for Mobile App Developer in Phoenix, AZ area","About me: Fifty something year old that has a Web Visual Design certification and Web Site Support certification.....but from 20+ years ago. My programming skillset is way outdated. Now working as a Value Stream Specialist for an Aerospace and Defense company in Phoenix, AZ. I help develop and implement Continuous Improvement ideas. In the course of doing my job , I come across app ideas that I think would be valuable to many companies with the same challenges. I have designed the user interface of industrial apps then paid an app developer through Upwork to build it. Now I am looking for an app developer in the Phoenix area that would be interested in partnering up with me to possibly launch a business to develop apps for industrial use. We would create apps for local businesses with the intention of developing it for one customer then selling it to other businesses across the USA once we have the bugs worked out. *No pay* for either of us until we start selling subscriptions to the apps, but you will get an *equity stake* in the business. We would build the app once then charge customers a subscription fee of couple hundred dollars a month to use it. Hundreds of customers across the USA paying us hundreds of dollars a month each. Then, who knows, the sky is the limit. The likely long range goal would be to sell the business for millions and exit.",3 days ago,https://www.reddit.com/r/AppDevelopers/comments/1mxs48y/looking_for_mobile_app_developer_in_phoenix_az/,r/AppDevelopers,2025-08-26 09:28:01.638385
Looking for Developer to Help Build Clothing Social Media Platform.,"I’m looking for a developer to help build a social media app focused around all things streetwear and other similar clothing. I've been working on the UI side in Figma and so can handle most of that although any experience/tips in it would be greatly appreciated. You’d handle the development side. This could be freelance or a longer-term collaboration. Would be great to discuss all this in detail even just for some advice. If you're into fashion, streetwear, or just want to help build something cool, DM me. Thanks!",22 days ago,https://www.reddit.com/r/AppDevelopers/comments/1mhjli3/looking_for_developer_to_help_build_clothing/,r/AppDevelopers,2025-08-26 09:28:01.739272
[Hiring] (Online) Need a graphic designer for a menu,"Hello! I am looking for someone who is able to create a menu for my bakery. The menu will consist of 14 items some have specific names and descriptions, others do not (I will specify in the DM's). I'm looking for someone who is able to make a pink, cutesy, bakery themed menu, I do have the pictures of the items we are listing so I will send those over as well. Essentially, we want something girly and cute. Willing to pay $15 per or more depending on quality of work!",12 hr. ago,https://www.reddit.com/r/forhire/comments/1mzy9ar/hiring_online_need_a_graphic_designer_for_a_menu/,r/forhire,2025-08-26 09:28:09.719937
[Hiring] (Remote) Social Media Post Scheduler $15/hr,"We're looking for someone reliable and organized to help us schedule our posts across social media. We’re an online news/media company based in The Netherlands that distributes content to a targeted audience. You’ll take content we’ve already created and schedule it on our social media channels, making sure it goes out at the right time and tags the right people/organistations. There’s no writing, designing, or content creation involved. Pay: $15/hour Schedule: Around 2 hours per day (can be flexible) Remote: Open to applicants worldwide No formal experience or education required, but you should:",18 days ago,https://www.reddit.com/r/forhire/comments/1ml2xun/hiring_remote_social_media_post_scheduler_15hr/,r/forhire,2025-08-26 09:28:09.836670
"[Hiring] 750$/mo , 2emails a week , need a copywriter asap",Hey I have an ecom bizandd need a copywriter for few emails a month Starting from 750$ a month Able to extend the budget if it is not -just another sh** freelancer - I don't care if it is agency or freelancer But I need to see some samples of ur previous work And also testimonials I accept any form of testimonials DM me for more details,6 hr. ago,https://www.reddit.com/r/forhire/comments/1n07q5b/hiring_750mo_2emails_a_week_need_a_copywriter_asap/,r/forhire,2025-08-26 09:28:09.995900
[FOR HIRE] Python Developer - Simple Projects for Portfolio Building,"**Python Developer Seeking Simple Projects** I'm a self-taught Python developer looking to build my portfolio and gain practical experience. I'm honest about my skill level and looking for projects that match my current capabilities. **Services I Offer:** • Python scripting and automation • Data processing and analysis • Basic web scraping • File manipulation and organization • Simple API integrations • Database operations (SQLite) • Basic Telegram bot development • Utility tool creation **My Strengths:** • Clean, well-documented code • Reliable communication • Honest about limitations • Quick learner • Attention to detail **Project Requirements:** • Clear, well-defined scope",18 min. ago,https://www.reddit.com/r/forhire/comments/1n0e5fg/for_hire_python_developer_simple_projects_for/,r/forhire,2025-08-26 09:28:10.145288
[HIRING] Easy Paid Gig — $20/hr,"Looking for someone to appear on TikTok Live. • No skills required • Just sit/act on live stream • Fun side gig for students/backpackers • Paid cash, flexible hours",4 days ago,https://www.reddit.com/r/forhire/comments/1mx0r77/hiring_easy_paid_gig_20hr/,r/forhire,2025-08-26 09:28:10.244081
