title,description,time_posted,url,subreddit,scraped_at
[Hiring] [Full Remote] [India] – AI/ML Engineer | D3V Technology Solutions,"We’re hiring AI/ML Engineers to join our fully remote team at D3V Technology Solutions (India-based candidates only). What we’re looking for: 1–3 years of experience in AI/ML Strong Python skills and familiarity with ML frameworks (like TensorFlow, PyTorch) Hands-on experience with building and deploying ML models (Docker, Streamlit, FastAPI, etc.) Bonus if you have:",1 mo. ago,https://www.reddit.com/r/remotepython/comments/1lkz9wx/hiring_full_remote_india_aiml_engineer_d3v/,r/remotepython,2025-08-05T15:32:47.989603
"Searching for Machine learning engineer openings, the best job board for fresh postings?",LinkedIn and Indeed feed me last month’s jobs. Any job boards have daily updated roles?,16 hr. ago,https://www.reddit.com/r/MachineLearningJobs/comments/1mhoplt/searching_for_machine_learning_engineer_openings/,r/MachineLearningJobs,2025-08-05T15:32:59.663615
[Hiring] Software Engineer - Tooling & AI Workflows ($50-90/hr),"Mercor is hiring Software Engineers to build tooling and workflows, which will be used to create complex training and evaluation data for large language models. Fully remote & asynchronous, 50-90 USD/hr. Be certain to update and tailor your CV to the job description. Following AI interview and application you will be notified. 10-40 hours a week, for 1 month with scope for extension. Key Responsibilities: Building data pipelines used to train frontier AI models Refining human expert-created datasets and transform them into signals used to evaluate models",1 day ago,https://www.reddit.com/r/MachineLearningJobs/comments/1mha7be/hiring_software_engineer_tooling_ai_workflows/,r/MachineLearningJobs,2025-08-05T15:32:59.862763
[Hiring][Hiring for 25 Jobs in the Crypto Space!],"Company Job Salary Date Location link Binance Binance Accelerator Program - Data Scientist, Risk (Machine Learning and Algorithms) $158K-$262K 2025-07-22 Taiwan, Taipei / Australia, Brisbane / Australia, Melbourne / Australia, Sydney / New Zealand, Auckland / New Zealand, Wellington / Philippines, Manila / South East Asia / Thailand, Bangkok / UAE, Abu Dhabi / UAE, Dubai / Vietnam, Ho Chi Minh Link Coinbase Staff Machine Learning Engineer - (Platform) $142K-$238K 2025-07-15 Remote - Canada Link Coinbase Machine Learning Engineer - (Platform) $120K-$200K 2025-07-15 Remote - USA Link Coinbase Senior Machine Learning Engineer - AI Platform",2 days ago,https://www.reddit.com/r/MachineLearningJobs/comments/1mghikn/hiringhiring_for_25_jobs_in_the_crypto_space/,r/MachineLearningJobs,2025-08-05T15:33:00.302415
[Hiring] [Remote] [USA] – AI Engineer (Mid to Senior),"Fonzi is a curated talent marketplace connecting top AI engineers with the world’s fastest-growing startups and leading tech companies. We’re backed by Lightspeed and built by a team of engineers, founders, and operators who believe that the future of hiring is agentic, high-signal, and human-centered. We’re looking for engineers with: 3+ years experience in ML/AI, or strong research + engineering hybrid background Proficiency with Python and ML frameworks (e.g., PyTorch, HuggingFace, LangChain)",8 days ago,https://www.reddit.com/r/MachineLearningJobs/comments/1mbmh62/hiring_remote_usa_ai_engineer_mid_to_senior/,r/MachineLearningJobs,2025-08-05T15:33:00.486278
Looking for a Web Developer,"We are currently looking for a talented web developer to help bring one of our projects to life. Compensation will depend on your experience and your ability to turn our ideas into reality. This is a one-project opportunity to start, but we have several more lined up. If things go well and you prove yourself on this first one, we’d be happy to continue working together long-term. I know my DMs will probably get flooded after this, but let’s try to keep things organized. Please send clear and transparent messages along with your portfolio. I’ll review every single one and reach out to those who seem like the best fit. Looking forward to hearing from everyone!",17 days ago,https://www.reddit.com/r/WebDeveloperJobs/comments/1m3rp1s/looking_for_a_web_developer/,r/WebDeveloperJobs,2025-08-05T15:33:10.670663
"[Hiring] Full Stack Developer (TypeScript, React, Next.js, Tailwind) based in India / LATAM","Hi! I'm looking for a talented Frontend Developer with 3-5 years of experience in TypeScript, React, Next.js, and Tailwind CSS for a full-time role. Ideal Candidate ✅ 3-5 years of hands-on experience building scalable, maintainable web applications using TypeScript, React, Next.js, and Tailwind CSS ✅ Strong skills in converting Figma designs into pixel-perfect, responsive user interfaces ✅ Comfortable working with RESTful APIs and integrating frontend with backend systems ✅ Experience using AI coding tools to boost productivity ✅ Excellent communication skills and a self-starter attitude",2 hr. ago,https://www.reddit.com/r/WebDeveloperJobs/comments/1mi63eq/hiring_full_stack_developer_typescript_react/,r/WebDeveloperJobs,2025-08-05T15:33:10.769158
[Hiring] Bakery Website - Really Small.,"Hey everyone, I am trying to have a bakery website made. It's simplistic, well... hopefully, there is only 1 product at the moment. It's should be easy to check out and buy the products from the opening page, so I don't think this will be more than 5 pages, including some small features or needed disclaimers. I have content and pictures readily available for project as well and a base website I already attempted making to discuss things from there. I want to be clear, I am not looking to be the apple of bakeries or even the Martha Stewart or anything. I want something solid that works, that is expansive if need be, and allows me to sell my cakes soon. If this interest you we can negotiate rates and what it would take to get this job done. If everything goes well I would love to expand the partnership as more work is needed and maintenance. Lastly, if this interest please email me at in your email for your header please place [Reddit, Website] so I know you read this and post any of your past work or portfolio, with hopeful citations of your work on the website in your email. Please do not send a message here, I will not see it.",18 hr. ago,https://www.reddit.com/r/WebDeveloperJobs/comments/1mhkxeg/hiring_bakery_website_really_small/,r/WebDeveloperJobs,2025-08-05T15:33:10.864576
"Developer – Python (FastAPI) & Next.js – Remote – ₹15,000/month – India Only","Hey folks! We’re a small but growing product/dev agency looking for an affordable, enthusiastic developer to join our team. If you have experience with Python (FastAPI) and Next.js (React), and you’re looking for a consistent, part-time (or junior full-time) gig, this could be for you. What We’re Looking For Solid hands-on experience in: Python (FastAPI) Next.js (React) Able to work remotely (anywhere in India) Good with Git, basic REST APIs, and modern dev tools Quick learner, responsible, able to communicate in English/Hindi About the Role Work: Help us build and maintain SaaS MVPs and web platforms Commitment: 7 hours / day Compensation: ₹15,000 INR/month (fixed – we know it’s not huge, but this is a real, stable remote role, with scope to grow if you deliver!)",1 hr. ago,https://www.reddit.com/r/WebDeveloperJobs/comments/1mi6ox6/developer_python_fastapi_nextjs_remote_15000month/,r/WebDeveloperJobs,2025-08-05T15:33:10.956231
We are looking for a webdeveloper,"Hello, We're a Cybersecurity company and is looking to build a website ( service ) for $600-$1000. We're thinking of developing one as in awwwards.com ultra modern style, with super good SEO and admin panels where we can publish stuff [Hiring][Remote]",1 day ago,https://www.reddit.com/r/WebDeveloperJobs/comments/1mh6sh1/we_are_looking_for_a_webdeveloper/,r/WebDeveloperJobs,2025-08-05T15:33:11.050889
FullStack Developer. Need Advice.,"How much should I charge for my services, software development (Full-Stack). I'm just getting started and I need advice on reaching clients. My goal for this month is to make at least around 500$. Give me advice on how I should find/approach clients, and how much I should charge or how I should calculate how much to charge. I'm a native English speaker with about a year and a half of experience in a professional environment. But many more years of general experience. Thank you. Feel free to ask questions regarding my experience.",2 hr. ago,https://www.reddit.com/r/WebDeveloperJobs/comments/1mi573g/fullstack_developer_need_advice/,r/WebDeveloperJobs,2025-08-05T15:33:11.152570
Looking for a Wordpress developer,"I’m looking for a Wordpress developer who also has some experience in copy/design. I will be providing the creative direction but you need to have a good sense of design and copy. I need an exact clone of an existing Wordpress site but with my content(text, images, logo and other assets) It is 7 pages static website. Real estate website. DM your project cost, timeline and mode of communication.",5 days ago,https://www.reddit.com/r/WebDeveloperJobs/comments/1me9nfb/looking_for_a_wordpress_developer/,r/WebDeveloperJobs,2025-08-05T15:33:11.270084
what comes after discovery phase in Software development?,One of our clients is currently looking for a Discovery Phase for their software development project. Can you share your experience on what exactly the company offers after the Discovery Phase in Agile?,2 hr. ago,https://www.reddit.com/r/WebDeveloperJobs/comments/1mi5c6k/what_comes_after_discovery_phase_in_software/,r/WebDeveloperJobs,2025-08-05T15:33:11.365965
"Looking for an app developer, for long term projects","I run a bootstrapped software studio, where we build apps for clients and inhouse apps as well. I'm looking for a builder (doesn't matter if you're a college student or a recent graduate) to join and help on a project. We will start off with 1 project and if it goes well then this will turn into a long term partnership. This is a 100% paid opportunity. Please comment if you're interested, I'll reach out with more details.",10 days ago,https://www.reddit.com/r/WebDeveloperJobs/comments/1m9n7vh/looking_for_an_app_developer_for_long_term/,r/WebDeveloperJobs,2025-08-05T15:33:11.458381
[Hiring] [Remote] [CET plus or minus 3 HOURS] - Senior Next.js Developer at Proxify (💸 $40k - $75k),Proxify is hiring a remote Senior Next.js Developer. Category: Software Development 💸Salary: $40k - $75k 📍Location: Remote (CET +/- 3 HOURS) See more and apply here!,19 hr. ago,https://www.reddit.com/r/WebDeveloperJobs/comments/1mhjtdv/hiring_remote_cet_plus_or_minus_3_hours_senior/,r/WebDeveloperJobs,2025-08-05T15:33:11.547964
"Web Developer (2 YOE) Looking for Job Opportunities – React, Java, SQL","Hi Reddit! I’m a 22-year-old web developer with 2 years of experience, currently looking for job opportunities in web development. Here’s a quick overview of my skills: Frontend: HTML, CSS, JavaScript, React Backend: Java (Spring Boot) Database: MySQL, PostgreSQL Others: Git, REST APIs, basic deployment & debugging I’ve worked on both personal and team projects, and I’m comfortable building full-stack applications. I’m passionate about clean code, responsive UI, and performance optimization. I’m open to: Full-time or remote jobs Junior/mid-level roles (open to learning and growing fast) If you know of any opportunities, or if you're building something and need an extra pair of hands — I’d love to connect!",20 hr. ago,https://www.reddit.com/r/WebDeveloperJobs/comments/1mhikt0/web_developer_2_yoe_looking_for_job_opportunities/,r/WebDeveloperJobs,2025-08-05T15:33:11.656558
Hiring 1-5+ exp software engineers (Freshers also welcome)- India,Hi we are hiring 1-5+ experienced software engineers in India any location. If you feel you are good problem solver in any tech stack please dm me. Team will call you. Regards,6 days ago,https://www.reddit.com/r/WebDeveloperJobs/comments/1mdi19u/hiring_15_exp_software_engineers_freshers_also/,r/WebDeveloperJobs,2025-08-05T15:33:11.746048
[Hiring] [Remote] [USA] - Junior Remote Web Developer,"1+ year of hands-on experience in software development Familiarity with HTML, CSS, and JavaScript Strong proficiency in at least one back-end programming language Based in the United States More info: https://juniordevshub.com/jobs/1133",1 day ago,https://www.reddit.com/r/WebDeveloperJobs/comments/1mha9m2/hiring_remote_usa_junior_remote_web_developer/,r/WebDeveloperJobs,2025-08-05T15:33:11.839734
Let me know if you need a web developer,"Hi there! I'm a relatively low cost web developer with experience in a variety of technologies, and I can provide testimonials and examples of my work if needed. Please do let me know if you need somebody to bring your idea to life, you can just DM me, and I'll be more than happy to do so. Thanks!",1 day ago,https://www.reddit.com/r/WebDeveloperJobs/comments/1mhaqhx/let_me_know_if_you_need_a_web_developer/,r/WebDeveloperJobs,2025-08-05T15:33:11.943062
[For Hire] $100 a week | full stack developer,"I’m aiming to make $100-200/week through solid, no-BS dev work. I’m a Full-Stack Developer with 3 years of experience working with react, nextjs, typescript, nodejs, sql, nosql, fastapi and Ai agent. development. I build things that run. • Backends, APIs, dashboards • Responsive UIs I am looking for: • Freelance gigs with tight timelines • Clear deliverables, small-to-medium scope • People who value speed, reliability, and clarity Keep it simple. You send the task, I'll get it done. To demonstrate my skills, I’m happy to complete a trial task, just let me know your requirements. If you’re building something or know someone who is, feel free to reach out. Thanks",1 day ago,https://www.reddit.com/r/WebDeveloperJobs/comments/1mh7f8r/for_hire_100_a_week_full_stack_developer/,r/WebDeveloperJobs,2025-08-05T15:33:12.034227
Web Developer Ready to Start IMMEDIATELY - Need Projects!,"CS Student with real experience looking for web development work. I can start your project this week. My Background: ✅ Database experience - Built systems for insurance companies (user registration, data management) ✅ MERN Stack - MongoDB, Express, React, Node.js ✅ Full-stack development - Frontend + Backend + Database ✅ Professional projects - Not just student exercises What I Build: 🌐 Business websites with custom functionality 💼 Web applications with user authentication 🛒 E-commerce solutions 📊 Admin dashboards and data management 📱 Responsive, mobile-first designs Why Hire Me: Available immediately - Student schedule = flexible hours Experienced with secure data handling (insurance sector background) Modern tech stack - No outdated methods Fair pricing - €25-30/hour or project-based quotes German work ethic - Reliable and thorough",1 day ago,https://www.reddit.com/r/WebDeveloperJobs/comments/1mh46zi/web_developer_ready_to_start_immediately_need/,r/WebDeveloperJobs,2025-08-05T15:33:12.128280
Hiring Full Stack Developer Interns (MERN) up to $3k/month,"Apply Here We're on the hunt for a tech-savvy individual with a passion for coding and a drive to learn and grow. As a Full Stack Developer Intern, you'll be working with our development team to build and maintain web applications, both on the front-end and back-end. You'll be focusing on the dashboard for our clients, integration with ATS and new features in the app for our community. Skills You'll Need to Bring: Strong knowledge of web development and coding principles. Familiarity with modern front-end frameworks (such as React) and back-end technologies (such as Node.js).",2 days ago,https://www.reddit.com/r/WebDeveloperJobs/comments/1mgkjs2/hiring_full_stack_developer_interns_mern_up_to/,r/WebDeveloperJobs,2025-08-05T15:33:12.227486
"[FOR HIRE] Full-Stack Web Developer – .NET Core, React, Node.js, PostgreSQL, MSSQL | Open to New Stacks","Hi everyone! I'm a web developer with solid experience in .NET Core (C#), React, Node.js, PostgreSQL, and MSSQL. I’ve been building full-stack applications and backend services for several years and am confident working on both new and existing projects. 🔧 Skills & Technologies: Backend: .NET Core (C#), Node.js, REST APIs Frontend: React (Hooks, Context), HTML, CSS, JavaScript Databases: PostgreSQL, MSSQL",8 days ago,https://www.reddit.com/r/WebDeveloperJobs/comments/1mbshk9/for_hire_fullstack_web_developer_net_core_react/,r/WebDeveloperJobs,2025-08-05T15:33:12.328462
[HIRING] - Senior Full-Stack Developer - Update Music Marketing Platform (T3 Stack + Turborepo),"We're disrupting the $16 billion music marketing industry and need a senior full-stack developer to help update our entire platform. This isn't just a contract gig - it's a potential pathway to a full-time, high-impact role at an investor-backed startup. What Makes This Different: You'll work directly with the founders (myself + 2 growth-focused co-founders) to architect and build something that actually matters. No layers of management, no corporate bureaucracy - just focused development on a platform that's already gaining serious traction. The Challenge: We're updating our platform in 4-6 weeks (targeting early September). It's ambitious, but we have clear requirements, solid architecture decisions, and founders who understand what it takes to ship quality code fast.",7 days ago,https://www.reddit.com/r/WebDeveloperJobs/comments/1mcdcfq/hiring_senior_fullstack_developer_update_music/,r/WebDeveloperJobs,2025-08-05T15:33:12.453423
"[FOR HIRE] Full-Stack Developer & DevOps Engineer | Laravel, Next.js, Elelctron, AWS | Remote (Indonesia) | $15/hr","Hi! 👋 I’m Afif, a full-stack developer based in Indonesia with strong experience in Laravel, Next.js, Electron, and DevOps on AWS or even traditional VPS. I'm currently available for remote freelance or contract work (short or long term). I’ve built landing pages, e-commerce platforms, desktop POS systems, and done cloud infra work with CI/CD pipelines. ✅ What I Bring: Full-stack development (Laravel, Next.js, React, Tailwind) DevOps (VPS, Heroku, Vercel, Cloudflare, AWS EC2, RDS, S3, Cloudflare, CI/CD)",8 days ago,https://www.reddit.com/r/WebDeveloperJobs/comments/1mbjsqz/for_hire_fullstack_developer_devops_engineer/,r/WebDeveloperJobs,2025-08-05T15:33:12.565012
We are looking for a webdeveloper,"Hello, We're a Cybersecurity company and is looking to build a website ( service ) for $600-$1000. We're thinking of developing one as in awwwards.com ultra modern style, with super good SEO and admin panels where we can publish stuff [Hiring][Remote]",22 days ago,https://www.reddit.com/r/WebDeveloperJobs/comments/1mh6sh1/we_are_looking_for_a_webdeveloper/,r/WebDeveloperJobs,2025-08-26 09:22:07.574428
[FOR HIRE] Web Developer | Years Experience | Affordable Rates | On-Time Delivery,"Hey everyone 👋 I’m a Web Developer with 3+ years of experience building and maintaining websites, web apps, and custom solutions. I’m currently available for new projects at your budget and can start right away. 🔹 What I Offer: Responsive, modern websites (HTML, CSS, JavaScript, React, Node.js) WordPress setup, customization & theme development Bug fixes, performance optimization, and redesigns E-commerce stores (Shopify, WooCommerce) API integrations and custom backend development 🔹 Why Work With Me: Flexible pricing (I’ll work within your budget) Fast turnaround times Clear communication & on-time delivery Strong experience working with small businesses, startups, and individuals",34 min. ago,https://www.reddit.com/r/WebDeveloperJobs/comments/1n0dsep/for_hire_web_developer_years_experience/,r/WebDeveloperJobs,2025-08-26 09:22:07.706840
Need A Frontend Developer,"I’m working on a project in my company and need an expert frontend developer, doesn’t matter if you haven’t worked with anyone, I just need to see if you have got any personal projects are proof of work. I want someone who’s young, ambitious, and serious to work. Friendly enough to be in a team. The pay is flexible. It will totally depend on the skills, time, and work you are willing to put. Feel free to comment and dm me.",2 days ago,https://www.reddit.com/r/WebDeveloperJobs/comments/1mybgon/need_a_frontend_developer/,r/WebDeveloperJobs,2025-08-26 09:22:07.812224
Offered $3/hour to build full backend and database over 3 months 🙂 is this normal?,"Hey everyone, I recently got an offer to work on a project where I’d be responsible for building the entire backend and database for a CRM system (Basically a complicated SaaS). It’s expected to take around 3 months, and the client offered $3 per hour. I’d be using NestJS and probably working with PostgreSQL, building things like authentication, API endpoints, user roles, and document handling essentially a CRM-like system with some accounting and document management features. For context, I have 3 years of experience with backend dev, and I can build this kind of thing with a some effort cause i'm new to NestJs (Not to NodeJS), but the rate feels extremely low for the amount of work and responsibility involved.",12 hr. ago,https://www.reddit.com/r/WebDeveloperJobs/comments/1mzyuhg/offered_3hour_to_build_full_backend_and_database/,r/WebDeveloperJobs,2025-08-26 09:22:07.915311
Senior full stack developer looking for a job.,"Senior Software Engineer with over 8 years of experience in full-stack development, delivering scalable, high-performance systems across diverse domains. Proven success in end-to-end feature delivery, from design to deployment, within agile and fast-paced environments. Adept at translating complex business requirements into clean, maintainable solutions. Experienced in working closely with cross-functional teams including product, design, and AI, contributing to rapid iteration cycles and continuous product improvement. Known for a strong execution mindset, attention to detail, and commitment to code quality and system reliability. I would be happy to discuss about any project or job. I am based in Hungary.",11 hr. ago,https://www.reddit.com/r/WebDeveloperJobs/comments/1mzzvwv/senior_full_stack_developer_looking_for_a_job/,r/WebDeveloperJobs,2025-08-26 09:22:08.035892
Looking for Frontend Developer,"Hey there! I'd love to team up with someone on a little hobby project of mine. I have a development background myself. It’s something with the potential to actually make money down the road. I’m pretty flexible when it comes to conditions. I’m happy to pay you, offer shares, or find a mix that works for both of us. The main thing is to have fun building something cool together while keeping the door open for it to grow into something bigger. If you enjoy frontend development, stay curious with new tech like AI, have built some hobby projects yourself, and love clean, tested code then let’s talk!",5 days ago,https://www.reddit.com/r/WebDeveloperJobs/comments/1mwfnma/looking_for_frontend_developer/,r/WebDeveloperJobs,2025-08-26 09:22:08.129148
Full-Stack Developer - 15-20k monthly stipend - 3 months - potential full-time,"Hiring for health tech startup. Looking for our second developer to join the team. Based out of Gurgaon, India. This is a remote role. Stack- Web: Next.js, TypeScript, TailwindCSS + shadcn/ui Mobile: React Native, StyleSheet, Expo Backend: Node.js, TypeScript, MongoDB If you’re interested please DM your GitHub/Resume/Portfolio.",7 days ago,https://www.reddit.com/r/WebDeveloperJobs/comments/1mueh13/fullstack_developer_1520k_monthly_stipend_3/,r/WebDeveloperJobs,2025-08-26 09:22:08.272036
Looking for a Developer for Web Tool Project,I’m looking to hire a developer to help build a simple web tool that processes social media links and outputs text. The site will need basic features like: Account creation & login Credit system / payment integration Handling single or bulk link inputs Generating text output,7 days ago,https://www.reddit.com/r/WebDeveloperJobs/comments/1mu66cq/looking_for_a_developer_for_web_tool_project/,r/WebDeveloperJobs,2025-08-26 09:22:08.390793
[For Hire] React + Node.js Full-Stack Web Developer | From $100 | Portfolio & Live Demos,"TL;DR: I build fast, secure, and maintainable web apps, landing pages, and websites using React, TypeScript, Node.js, and PostgreSQL. Portfolio & live demos → pritam.studio 💻 What I Offer (Packages) Portfolio / Simple Website — $100 / 2 days (Personal site, resume, blog, business showcase) Landing Page Build/Rebuild — $280 / 3 days (Boost leads & conversions with a modern responsive page)",19 hr. ago,https://www.reddit.com/r/WebDeveloperJobs/comments/1mznn1h/for_hire_react_nodejs_fullstack_web_developer/,r/WebDeveloperJobs,2025-08-26 09:22:08.507258
Need A Freelance Web Developer,Need A Next.js / Flutter / React Native developer. No min experience required but you should comment below your portfolio site or GitHub link and links to your previous projects. Please don’t spam into my DM🙃 reply here only with your link.,15 days ago,https://www.reddit.com/r/WebDeveloperJobs/comments/1mn8zag/need_a_freelance_web_developer/,r/WebDeveloperJobs,2025-08-26 09:22:08.599218
[For Hire] full stack software developer all tech stack knowledge,"hii everyone i am a full stack developer looking for a new gig i already have 4.5+years experience currently my 2 own products are live while 3rd one in mvp phase looking for a remote job in US, UK, Canada and Australia, please Indian cto and hiring team don't reach because i personally dont want work with indian clients due to past experiences please pm me if anyone like to discuss further",1 day ago,https://www.reddit.com/r/WebDeveloperJobs/comments/1mzgmkn/for_hire_full_stack_software_developer_all_tech/,r/WebDeveloperJobs,2025-08-26 09:22:08.781380
